{"dataset":"b4e87a7ec2609353609fa39e44be2433860daf2d1901a25a545ae5d0a01ca8b8","definition_id":"ticket-triage","definition_revision":"af1fc5bb79fc02204d83676bf772ec20288b962fb5a1746451f678e0bb12357c","evidence":"measured","evidence_revision":"b957bd5dc070aa8241cba76114c0623b9c5272b8044d797ce789f01016bd2d29","id":"ticket-triage","metrics":{"accepted":25,"agreement":1,"coverage":0.6410256410256411,"metric":"all_required_agree","n":39,"wilson_lower":0.8668077490609514},"min_accepted":20,"model":"jev-1.13.0","policy_revision":"b3bc7d6af947e0ae8aaeb0868ab30d719420870c4a4b380b61e9458373d12bd2","schema_version":"1.0","target":0.8,"thresholds":{"sentiment":0.6,"tags.billing":0.6,"tags.bug":0.6,"tags.security":0.6,"team":0.6,"urgent":0.6}}
