{"dataset":"eaef6396b5f3129189fb27caded9133f0a680d3e9d26b77fe868974dec1c1047","definition_id":"opencode.task-route","definition_revision":"3a4bc3c29ff9860516a916cb407fb31d0cb77fd6e3045b234575415dc1bd8206","evidence":"fixture","evidence_revision":"fce6fc21a716d0a73a2e071bd9576ecafd2f4c647d7e56f374062283ece7cb39","id":"opencode.task-route","metrics":{"accepted":120,"agreement":1,"coverage":1,"metric":"all_required_agree","n":120,"wilson_lower":0.9689808335812966},"min_accepted":50,"model":"jev-1.13.0","policy_revision":"90204fe05595a3193ed709f1223a39b18daddcbe465810c30bf49db0c801a5c1","schema_version":"1.0","target":0,"thresholds":{"route":0}}
