{"dataset":"f004fcf085b88f15047e8916d029b4851ce4ab0d07cd70658dc0072c9abe01fb","definition_id":"claude-code.task-route","definition_revision":"df8f4acf4a044d327cc75545d19b0564d33d49cb74e63e869ca35ad54f414aa6","evidence":"fixture","evidence_revision":"427a81a8d1ee6aa6f2605b529f89f360e55fdb697fc143ae3ee1a5ec704b91c0","id":"claude-code.task-route","metrics":{"accepted":120,"agreement":0.9583333333333334,"coverage":1,"metric":"all_required_agree","n":120,"wilson_lower":0.9061591476629647},"min_accepted":50,"model":"jev-1.13.0","policy_revision":"c3b73abf7251ad8a0bdf694fc4d71ff69eea8deaa6c734e059762473cdc45f15","schema_version":"1.0","target":0,"thresholds":{"route":0}}
