{
  "schema_version": "1.0",
  "id": "task-route-demo",
  "policy_revision": "3ba449d5d7584eaeb89e97baee7e77b049769ae086206a22ac49922a7f98ca1f",
  "definition_id": "task-route",
  "definition_revision": "6015a48e00c0c99a3e208c21e3d4d92431e8c2c22a446805c5db7f50eca9b5d5",
  "model": "jev-1.13.0",
  "evidence": "experimental",
  "thresholds": {
    "route": 0.85
  }
}
